{"aggregateOutcome":"incomplete","totalChangeCount":35,"changeCountsByClassification":{"breaking":4,"unknown":2,"additive":29},"mostSevereClassification":"breaking","layers":[{"layer":"sourceContract","outcome":"changed"},{"layer":"semanticModel","outcome":"changed"},{"layer":"kotlinApi","outcome":"changed"},{"layer":"behavior","outcome":"unavailable","unavailableReason":{"code":"missing-behavior-evidence"}},{"layer":"abi","outcome":"unavailable","unavailableReason":{"code":"missing-layer-evidence"}}],"changes":[{"id":"compat-v1:kotlinApi:function:202d9ed9c7cd1a30","layer":"kotlinApi","classification":"breaking","summary":"Change Kotlin API function com.nabobery.sdkgen.generated.betaresponses.BetaResponsesClient#createResponsesStream(com.nabobery.sdkgen.generated.ResponsesRequest,kotlin.String?,kotlin.String?,com.nabobery.sdkgen.generated.MetadataLevel?,kotlin.String?,com.nabobery.sdkgen.runtime.CallOptions)","evidence":[{"kind":"declaration-projection","identity":"projection:v0.3.0-kotlin-api.json","sha256":"e353ac8a21a4047891030023b32e0a3147d63d30540ff281f82344e48af53fd4"},{"kind":"declaration-projection","identity":"projection:v0.4.0-kotlin-api.json","sha256":"142a6dfc383d2aed0c649ccddc62c759116ebbde92dd2836e6e1553887f328cf"}]},{"id":"compat-v1:kotlinApi:function:76f1952bc10656fd","layer":"kotlinApi","classification":"breaking","summary":"Change Kotlin API function com.nabobery.sdkgen.generated.chat.ChatClient#sendChatCompletionRequestStream(com.nabobery.sdkgen.generated.ChatRequest,kotlin.String?,kotlin.String?,com.nabobery.sdkgen.generated.MetadataLevel?,kotlin.String?,com.nabobery.sdkgen.runtime.CallOptions)","evidence":[{"kind":"declaration-projection","identity":"projection:v0.3.0-kotlin-api.json","sha256":"e353ac8a21a4047891030023b32e0a3147d63d30540ff281f82344e48af53fd4"},{"kind":"declaration-projection","identity":"projection:v0.4.0-kotlin-api.json","sha256":"142a6dfc383d2aed0c649ccddc62c759116ebbde92dd2836e6e1553887f328cf"}]},{"id":"compat-v1:kotlinApi:function:915a23ef9129bf14","layer":"kotlinApi","classification":"breaking","summary":"Change Kotlin API function com.nabobery.sdkgen.generated.anthropicmessages.AnthropicMessagesClient#createMessagesStream(com.nabobery.sdkgen.generated.MessagesRequest,kotlin.String?,kotlin.String?,com.nabobery.sdkgen.generated.MetadataLevel?,kotlin.String?,com.nabobery.sdkgen.runtime.CallOptions)","evidence":[{"kind":"declaration-projection","identity":"projection:v0.3.0-kotlin-api.json","sha256":"e353ac8a21a4047891030023b32e0a3147d63d30540ff281f82344e48af53fd4"},{"kind":"declaration-projection","identity":"projection:v0.4.0-kotlin-api.json","sha256":"142a6dfc383d2aed0c649ccddc62c759116ebbde92dd2836e6e1553887f328cf"}]},{"id":"compat-v1:kotlinApi:function:cc42db273c67222a","layer":"kotlinApi","classification":"breaking","summary":"Change Kotlin API function com.nabobery.sdkgen.generated.images.ImagesClient#createImagesStream(com.nabobery.sdkgen.generated.ImageGenerationRequest,kotlin.String?,kotlin.String?,kotlin.String?,com.nabobery.sdkgen.runtime.CallOptions)","evidence":[{"kind":"declaration-projection","identity":"projection:v0.3.0-kotlin-api.json","sha256":"e353ac8a21a4047891030023b32e0a3147d63d30540ff281f82344e48af53fd4"},{"kind":"declaration-projection","identity":"projection:v0.4.0-kotlin-api.json","sha256":"142a6dfc383d2aed0c649ccddc62c759116ebbde92dd2836e6e1553887f328cf"}]},{"id":"compat-v1:semanticModel:snapshot:f1a0df8915ed4afb","layer":"semanticModel","classification":"unknown","summary":"Semantic model snapshot evidence changed","evidence":[{"kind":"semantic-model","identity":"manifest:semantic-model","sha256":"17dd839787efc771aa7c02c23c0eba8228198d1096c896cb4ea465e883ff039f"},{"kind":"semantic-model","identity":"manifest:semantic-model","sha256":"b1e81b945cf0cb9e992fddac720aeadef8e2a3e664112f087aeb5e1545611db8"}]},{"id":"compat-v1:sourceContract:effective-contract:fcf94abd55f8c4dc","layer":"sourceContract","classification":"unknown","summary":"Source contract evidence changed for effective-contract:manifest:effective-contract","evidence":[{"kind":"effective-contract","identity":"manifest:effective-contract","sha256":"41cddcc52f282dd4ebf89a69fd4011fc0708bb5a8b9acab03e1f40bc9008a7fc"},{"kind":"effective-contract","identity":"manifest:effective-contract","sha256":"24da615c4ef7de4d244f9a21c1980afc195f1cc9fd89446178cba8ee17cd0cdf"}]},{"id":"compat-v1:kotlinApi:function:049e6d87894a67c2","layer":"kotlinApi","classification":"additive","summary":"Add Kotlin API function com.nabobery.sdkgen.generated.observability.ObservabilityClient#<init>(com.nabobery.sdkgen.runtime.SdkTransport,kotlin.String,com.nabobery.sdkgen.runtime.SdkClientConfig,kotlin.collections.Map<kotlin.String,com.nabobery.sdkgen.runtime.auth.CredentialProvider>,com.nabobery.sdkgen.runtime.auth.TrustedHosts?,com.nabobery.sdkgen.runtime.SdkAuthentication?)","evidence":[{"kind":"declaration-projection","identity":"projection:v0.3.0-kotlin-api.json","sha256":"e353ac8a21a4047891030023b32e0a3147d63d30540ff281f82344e48af53fd4"},{"kind":"declaration-projection","identity":"projection:v0.4.0-kotlin-api.json","sha256":"142a6dfc383d2aed0c649ccddc62c759116ebbde92dd2836e6e1553887f328cf"}]},{"id":"compat-v1:kotlinApi:function:092071dcb16a615f","layer":"kotlinApi","classification":"additive","summary":"Add Kotlin API function com.nabobery.sdkgen.generated.chat.ChatClient#<init>(com.nabobery.sdkgen.runtime.SdkTransport,kotlin.String,com.nabobery.sdkgen.runtime.SdkClientConfig,kotlin.collections.Map<kotlin.String,com.nabobery.sdkgen.runtime.auth.CredentialProvider>,com.nabobery.sdkgen.runtime.auth.TrustedHosts?,com.nabobery.sdkgen.runtime.SdkAuthentication?)","evidence":[{"kind":"declaration-projection","identity":"projection:v0.3.0-kotlin-api.json","sha256":"e353ac8a21a4047891030023b32e0a3147d63d30540ff281f82344e48af53fd4"},{"kind":"declaration-projection","identity":"projection:v0.4.0-kotlin-api.json","sha256":"142a6dfc383d2aed0c649ccddc62c759116ebbde92dd2836e6e1553887f328cf"}]},{"id":"compat-v1:kotlinApi:function:195e048ac1e7595e","layer":"kotlinApi","classification":"additive","summary":"Add Kotlin API function com.nabobery.sdkgen.generated.providers.ProvidersClient#<init>(com.nabobery.sdkgen.runtime.SdkTransport,kotlin.String,com.nabobery.sdkgen.runtime.SdkClientConfig,kotlin.collections.Map<kotlin.String,com.nabobery.sdkgen.runtime.auth.CredentialProvider>,com.nabobery.sdkgen.runtime.auth.TrustedHosts?,com.nabobery.sdkgen.runtime.SdkAuthentication?)","evidence":[{"kind":"declaration-projection","identity":"projection:v0.3.0-kotlin-api.json","sha256":"e353ac8a21a4047891030023b32e0a3147d63d30540ff281f82344e48af53fd4"},{"kind":"declaration-projection","identity":"projection:v0.4.0-kotlin-api.json","sha256":"142a6dfc383d2aed0c649ccddc62c759116ebbde92dd2836e6e1553887f328cf"}]},{"id":"compat-v1:kotlinApi:function:19743d89499f62e5","layer":"kotlinApi","classification":"additive","summary":"Add Kotlin API function com.nabobery.sdkgen.generated.workspaces.WorkspacesClient#<init>(com.nabobery.sdkgen.runtime.SdkTransport,kotlin.String,com.nabobery.sdkgen.runtime.SdkClientConfig,kotlin.collections.Map<kotlin.String,com.nabobery.sdkgen.runtime.auth.CredentialProvider>,com.nabobery.sdkgen.runtime.auth.TrustedHosts?,com.nabobery.sdkgen.runtime.SdkAuthentication?)","evidence":[{"kind":"declaration-projection","identity":"projection:v0.3.0-kotlin-api.json","sha256":"e353ac8a21a4047891030023b32e0a3147d63d30540ff281f82344e48af53fd4"},{"kind":"declaration-projection","identity":"projection:v0.4.0-kotlin-api.json","sha256":"142a6dfc383d2aed0c649ccddc62c759116ebbde92dd2836e6e1553887f328cf"}]},{"id":"compat-v1:kotlinApi:function:429a00e054b31d42","layer":"kotlinApi","classification":"additive","summary":"Add Kotlin API function com.nabobery.sdkgen.generated.benchmarks.BenchmarksClient#<init>(com.nabobery.sdkgen.runtime.SdkTransport,kotlin.String,com.nabobery.sdkgen.runtime.SdkClientConfig,kotlin.collections.Map<kotlin.String,com.nabobery.sdkgen.runtime.auth.CredentialProvider>,com.nabobery.sdkgen.runtime.auth.TrustedHosts?,com.nabobery.sdkgen.runtime.SdkAuthentication?)","evidence":[{"kind":"declaration-projection","identity":"projection:v0.3.0-kotlin-api.json","sha256":"e353ac8a21a4047891030023b32e0a3147d63d30540ff281f82344e48af53fd4"},{"kind":"declaration-projection","identity":"projection:v0.4.0-kotlin-api.json","sha256":"142a6dfc383d2aed0c649ccddc62c759116ebbde92dd2836e6e1553887f328cf"}]},{"id":"compat-v1:kotlinApi:function:505cb013dc71b6c2","layer":"kotlinApi","classification":"additive","summary":"Add Kotlin API function com.nabobery.sdkgen.generated.videogeneration.VideoGenerationClient#<init>(com.nabobery.sdkgen.runtime.SdkTransport,kotlin.String,com.nabobery.sdkgen.runtime.SdkClientConfig,kotlin.collections.Map<kotlin.String,com.nabobery.sdkgen.runtime.auth.CredentialProvider>,com.nabobery.sdkgen.runtime.auth.TrustedHosts?,com.nabobery.sdkgen.runtime.SdkAuthentication?)","evidence":[{"kind":"declaration-projection","identity":"projection:v0.3.0-kotlin-api.json","sha256":"e353ac8a21a4047891030023b32e0a3147d63d30540ff281f82344e48af53fd4"},{"kind":"declaration-projection","identity":"projection:v0.4.0-kotlin-api.json","sha256":"142a6dfc383d2aed0c649ccddc62c759116ebbde92dd2836e6e1553887f328cf"}]},{"id":"compat-v1:kotlinApi:function:5d562848ed5cfefe","layer":"kotlinApi","classification":"additive","summary":"Add Kotlin API function com.nabobery.sdkgen.generated.endpoints.EndpointsClient#<init>(com.nabobery.sdkgen.runtime.SdkTransport,kotlin.String,com.nabobery.sdkgen.runtime.SdkClientConfig,kotlin.collections.Map<kotlin.String,com.nabobery.sdkgen.runtime.auth.CredentialProvider>,com.nabobery.sdkgen.runtime.auth.TrustedHosts?,com.nabobery.sdkgen.runtime.SdkAuthentication?)","evidence":[{"kind":"declaration-projection","identity":"projection:v0.3.0-kotlin-api.json","sha256":"e353ac8a21a4047891030023b32e0a3147d63d30540ff281f82344e48af53fd4"},{"kind":"declaration-projection","identity":"projection:v0.4.0-kotlin-api.json","sha256"